Municipal,MMM/BID 766: 2024/2025,INSTALLATION OF WATER AND SEWER IN TAMBO SQUARE,08/11/2024,10/12/2024,Mangaung Metropolitan Municipality,Request for Bid,Free State,Bloemfontein,,,,,,,,11:30am,,,,https://www.mangaung.co.za/2024/11/08/list-of-available-bids-191/,,Mangaung
Municipal,MMM/BID 767: 2024/2025,SUPPLY AND DELIVERY STATIONERY FOR MANGAUNG METROPOLITAN MUNICIPALITY,08/11/2024,09/12/2024,Mangaung Metropolitan Municipality,Request for Bid,Free State,Bloemfontein,,,,,,,,11:30am,,,,https://www.mangaung.co.za/2024/11/08/list-of-available-bids-191/,,Mangaung
Municipal,MMM/BID 768: 2024/2025,APPOINTMENT OF AN AUCTIONEER TO RENDER AUCTIONEERING SERVICES TO THE MANGAUNG METRO MUNICIPALITY,08/11/2024,10/12/2024,Mangaung Metropolitan Municipality,Request for Bid,Free State,Bloemfontein,,,,,,,,11:30am,,,,https://www.mangaung.co.za/2024/11/08/list-of-available-bids-191/,,Mangaung
Municipal,MMM/BID 769: 2024/2025,APPOINTMENT OF AN EXPERIENCED SERVICE PROVIDER (S) FOR THE SUPPLY AND DELIVERY OF COMPUTERS AND RELATED HARDWARE EQUIPMENT FOR MANGAUNG METROPOLITAN MUNICIPALITY,08/11/2024,09/12/2024,Mangaung Metropolitan Municipality,Request for Bid,Free State,Bloemfontein,,,,,,,,11:30am,,,,https://www.mangaung.co.za/2024/11/08/list-of-available-bids-191/,,Mangaung
Municipal,MMM/BID 770: 2024/2025,HIGH DENSITY MOBILE SHELVING SYSTEM FOR LAND USE CONTROL OFFICES,08/11/2024,11/12/2024,Mangaung Metropolitan Municipality,Request for Bid,Free State,Bloemfontein,,,,,,,,11:30am,,,,https://www.mangaung.co.za/2024/11/08/list-of-available-bids-191/,,Mangaung
Municipal,MMM/BID 771: 2024/2025,"COMPILATION OF GENERAL VALUATION ROLL, AND SUPPLEMENTARY ROLL(S) AS WELL AS FULFILLING ALL THE REQUIREMENTS OF THIS TENDER UNTIL THE EXPIRY OF THE CONTRACT AS SET OUT IN MUNICIPAL PROPERTY RATES ACT, ACT 6 OF 2004 AS AMENDED",08/11/2024,10/12/2024,Mangaung Metropolitan Municipality,Request for Bid,Free State,Bloemfontein,,,,,,,,11:30am,,,,https://www.mangaung.co.za/2024/11/08/list-of-available-bids-191/,,Mangaung
Municipal,MMM/BID 772: 2024/2025,APPOINTMENT OF AN EXPERIENCED SERVICE PROVIDER FOR THE SUPPLY AND MAINTENANCE OF TWO WAY RADIOS AND RELATED EQUIPMENT FOR MANGAUNG METROPOLITAN MUNICIPALITY,08/11/2024,09/12/2024,Mangaung Metropolitan Municipality,Request for Bid,Free State,Bloemfontein,,,,,,,,11:30am,,,,https://www.mangaung.co.za/2024/11/08/list-of-available-bids-191/,,Mangaung
Municipal,MMM/BID 773: 2024/2025,APPOINTMENT OF AN EXPERIENCED SERVICE PROVIDER(S) FOR THE LEASING OF PRINTERS AND RELATED EQUIPMENT FOR MANGAUNG METROPOLITAN MUNICIPALITY,08/11/2024,09/12/2024,Mangaung Metropolitan Municipality,Request for Bid,Free State,Bloemfontein,,,,,,,,11:30am,,,,https://www.mangaung.co.za/2024/11/08/list-of-available-bids-191/,,Mangaung
Municipal,MMM/BID 705(A): 2024/2025,"PURCHASING, SUPPLY, DELIVERY, INSTALLATION, COMMISSIONING OF ELECTRONIC TRAFFIC LAW ENFORCEMENT SYSTEMS AND EQUIPMENT FOR TRAFFIC VIOLATION",25/10/2024,08/11/2024,Mangaung Metropolitan Municipality,Request for Bid,Free State,Bloemfontein,,,,,,,,11:30am,,,,https://www.mangaung.co.za/2024/10/25/list-of-available-bids-190/,,Mangaung
Municipal,MMM/BID 762: 2024/2025,"APPOINTMENT OF AN EXPERIENCED SERVICE PROVIDER FOR PROVIDING NETWORK SERVICES, CONDUCT NETWORK ASSESSMENT, MAINTENANCE OF HIGH SITES AND PROCUREMENT OF NETWORK RELATED EQUIPMENT IN MANGAUNG METROPOLITAN MUNICIPALITY FOR PERIOD ENDING 30 JUNE 2026",25/10/2024,27/11/2024,Mangaung Metropolitan Municipality,Request for Bid,Free State,Bloemfontein,,,,,,,,11:30am,,,,https://www.mangaung.co.za/2024/10/25/list-of-available-bids-190/,,Mangaung
Municipal,MMM/BID 763: 2024/2025,"SUPPLY, DELIVERY AND GENERAL REPAIRS OF HYDRAULICS AND VACUUM",25/10/2024,27/11/2024,Mangaung Metropolitan Municipality,Request for Bid,Free State,Bloemfontein,,,,,,,,11:30am,,,,https://www.mangaung.co.za/2024/10/25/list-of-available-bids-190/,,Mangaung
Municipal,MMM/BID 764: 2024/2025,PROVISION OF VETERINARY SERVICES TO MANGAUNG METROPOLITAN MUNICIPALITY,25/10/2024,28/11/2024,Mangaung Metropolitan Municipality,Request for Bid,Free State,Bloemfontein,,,,,,,,11:30am,,,,https://www.mangaung.co.za/2024/10/25/list-of-available-bids-190/,,Mangaung
Municipal,MMM/BID 765: 2024/2025,LEASE AGREEMENT TO OPERATE THE EDGE RESTAURANT-,25/10/2024,28/11/2024,Mangaung Metropolitan Municipality,Request for Bid,Free State,Bloemfontein,,,,,,,,11:30am,,,,https://www.mangaung.co.za/2024/10/25/list-of-available-bids-190/,,Mangaung
Municipal,MMM/BID 680(01): 2024/2025,RENDERING OF PLUMBING BUILDING MAINTENANCE AND REPAIR SERVICES (AS AND WHEN REQUIRED) TO MANGAUNG METRO MUNICIPALITY (AUGMENTATION),23/08/2024,26/09/2024,Mangaung Metropolitan Municipality,Request for Bid,Free State,Bloemfontein,,,,,,,,11:30am,,,,https://www.mangaung.co.za/2024/08/23/list-of-available-bids-188/,,Mangaung
Municipal,MMM/BID 699(01): 2024/2025,PANEL OF SERVICES PROVIDERS FOR RENDERING OF TRADE WASTE COLLECTION SERVICE FROM BUSINESSES WITHIN MANGAUNG METRO MUNICIPALITY (AUGMENTATION),23/08/2024,09/09/2024,Mangaung Metropolitan Municipality,Request for Bid,Free State,Bloemfontein,,,,,,,,11:30am,,,,https://www.mangaung.co.za/2024/08/23/list-of-available-bids-188/,,Mangaung
Municipal,MMM/BID 712(A): 2024/2025,"THE INSTALLATION, SUPPLY, MAINTENANCE, INSPECTION AND SERVICING OF FIREFIGHTING EQUIPMENT’S IN THE BUILDINGS FOR MANGAUNG METRO MUNICIPALITY",23/08/2024,26/09/2024,Mangaung Metropolitan Municipality,Request for Bid,Free State,Bloemfontein,,,,,,,,11:30am,,,,https://www.mangaung.co.za/2024/08/23/list-of-available-bids-188/,,Mangaung
Municipal,MMM/BID 714(A): 2024/2025,SUPPLY AND DELIVERY OF FACE VALUE BOOKS AND OTHER RELATED ITEMS FOR MANGAUNG METRO MUNICIPALITY.,23/08/2024,09/09/2024,Mangaung Metropolitan Municipality,Request for Bid,Free State,Bloemfontein,,,,,,,,11:30am,,,,https://www.mangaung.co.za/2024/08/23/list-of-available-bids-188/,,Mangaung
Municipal,MMM/BID 676(A): 2024/2025,THABA NCHU WATER AND SANITATION AT EXT 27 MOROKA AND RATAU,23/08/2024,27/09/2024,Mangaung Metropolitan Municipality,Request for Bid,Free State,Bloemfontein,,,,,,,,11:30am,,,,https://www.mangaung.co.za/2024/08/23/list-of-available-bids-188/,,Mangaung
Municipal,MMM/BID 719(A): 2024/2025,PROVISION OF BANKING SERVICES,23/08/2024,23/09/2024,Mangaung Metropolitan Municipality,Request for Bid,Free State,Bloemfontein,,,,,,,,11:30am,,,,https://www.mangaung.co.za/2024/08/23/list-of-available-bids-188/,,Mangaung
Municipal,MMM/BID: 724(A): 2024/2025,OUTDOOR ADVERTISEMENT RIGHTS – COOLING TOWERS.,23/08/2024,27/09/2024,Mangaung Metropolitan Municipality,Request for Bid,Free State,Bloemfontein,,,,,,,,11:30am,,,,https://www.mangaung.co.za/2024/08/23/list-of-available-bids-188/,,Mangaung
Municipal,MMM/BID: 725(A): 2024/2025,APPOINTMENT OF SERVICE PROVIDER S FOR THE SUPPLY AND DELIVERY OF VARIOUS CATEGORIES OF VEHICLES UNDER MAINTENANCE LEASE,23/08/2024,30/09/2024,Mangaung Metropolitan Municipality,Request for Bid,Free State,Bloemfontein,,,,,,,,11:30am,,,,https://www.mangaung.co.za/2024/08/23/list-of-available-bids-188/,,Mangaung
Municipal,MMM/BID 747: 2024/2025,INSTALLATION OF WATER AND SANITATION AT MKHONTO ERF 32109 SALIVA 35180 AND 8323,23/08/2024,01/10/2024,Mangaung Metropolitan Municipality,Request for Bid,Free State,Bloemfontein,,,,,,,,11:30am,,,,https://www.mangaung.co.za/2024/08/23/list-of-available-bids-188/,,Mangaung
Municipal,MMM/BID 748: 2024/2025,APPOINTMENT OF THE LAND SURVEYING SERVICES WITHIN MANGAUNG METRO MUNICIPALITY (PANEL OF LAND SURVEYORS).,23/08/2024,01/10/2024,Mangaung Metropolitan Municipality,Request for Bid,Free State,Bloemfontein,,,,,,,,11:30am,,,,https://www.mangaung.co.za/2024/08/23/list-of-available-bids-188/,,Mangaung
Municipal,MMM/BID 749: 2024/2025,THE INSTALLATION OF WATER AND SEWER IN BOTSHABELO SECTION H2873 AND G1011.,23/08/2024,02/10/2024,Mangaung Metropolitan Municipality,Request for Bid,Free State,Bloemfontein,,,,,,,,11:30am,,,,https://www.mangaung.co.za/2024/08/23/list-of-available-bids-188/,,Mangaung
Municipal,MMM/BID 750: 2024/2025,APPOINTMENT OF CONTRACTOR AT BOTSHABELO SECTION R INSTALLATION OF INTERNAL WATER RETICULATION,23/08/2024,03/10/2024,Mangaung Metropolitan Municipality,Request for Bid,Free State,Bloemfontein,,,,,,,,11:30am,,,,https://www.mangaung.co.za/2024/08/23/list-of-available-bids-188/,,Mangaung
Municipal,MMM/BID 751: 2024/2025,SUPPLY AND DELIVERY OF PHOTOCOPYING PAPER FOR MANGAUNG METRO MUNICIPALITY,23/08/2024,04/10/2024,Mangaung Metropolitan Municipality,Request for Bid,Free State,Bloemfontein,,,,,,,,11:30am,,,,https://www.mangaung.co.za/2024/08/23/list-of-available-bids-188/,,Mangaung
Municipal,MMM/BID 752: 2024/2025,"ELECTRONIC IRRIGATION INSPECTION, REPORTING AND MAINTENANCE SERVICE CONTRACT IN MMM AREA AS AND WHEN NEEDED",23/08/2024,04/10/2024,Mangaung Metropolitan Municipality,Request for Bid,Free State,Bloemfontein,,,,,,,,11:30am,,,,https://www.mangaung.co.za/2024/08/23/list-of-available-bids-188/,,Mangaung
Municipal,MMM/BID 753: 2024/2025,SUPPLY OF SPARES AND GENERAL MAINTENANCE OF FLEET,23/08/2024,07/10/2024,Mangaung Metropolitan Municipality,Request for Bid,Free State,Bloemfontein,,,,,,,,11:30am,,,,https://www.mangaung.co.za/2024/08/23/list-of-available-bids-188/,,Mangaung
Municipal,MMM/BID 754: 2024/2025,AUTO ELECTRICAL SERVICES,23/08/2024,07/10/2024,Mangaung Metropolitan Municipality,Request for Bid,Free State,Bloemfontein,,,,,,,,11:30am,,,,https://www.mangaung.co.za/2024/08/23/list-of-available-bids-188/,,Mangaung
Municipal,MMM/BID 755: 2024/2025,SUPPLY AND DELIVERY OF REFUSE PLASTIC BAGS FOR MANGAUNG METRO MUNICIPALITY,23/08/2024,09/10/2024,Mangaung Metropolitan Municipality,Request for Bid,Free State,Bloemfontein,,,,,,,,11:30am,,,,https://www.mangaung.co.za/2024/08/23/list-of-available-bids-188/,,Mangaung
Municipal,MMM/BID 756: 2024/2025,SUPPLY AND DELIVERY OF TOILET PAPER FOR MANGAUNG METRO MUNICIPALITY,23/08/2024,09/10/2024,Mangaung Metropolitan Municipality,Request for Bid,Free State,Bloemfontein,,,,,,,,11:30am,,,,https://www.mangaung.co.za/2024/08/23/list-of-available-bids-188/,,Mangaung
Municipal,MMM/BID 757: 2024/2025,"APPOINTMENT OF THREE (3) CONTRACTORS FOR THE GENERAL ROUTINE MAINTENANCE OF WATER SUPPLY SYSTEM INCLUDING REPAIRS OF BULK PIPELINES, SEWER NETWORK, RESERVOIRS, DAM-RESEALING AND SPECIALIZED WORK AS AND WHEN REQUIRED",23/08/2024,10/10/2024,Mangaung Metropolitan Municipality,Request for Bid,Free State,Bloemfontein,,,,,,,,11:30am,,,,https://www.mangaung.co.za/2024/08/23/list-of-available-bids-188/,,Mangaung
Municipal,MMM/BID 758: 2024/2025,APPOINTMENT OF THREE (3) CONTRACTORS FOR GENERAL ROUTINE MAINTENANCE OF BUILDING WORKS AND SPECIALIZED WORK AS AND WHEN REQUIRED,23/08/2024,11/10/2024,Mangaung Metropolitan Municipality,Request for Bid,Free State,Bloemfontein,,,,,,,,11:30am,,,,https://www.mangaung.co.za/2024/08/23/list-of-available-bids-188/,,Mangaung
Municipal,MMM/BID 759: 2024/2025,"APPOINTMENT OF PANEL OF CONTRACTORS: THREE (3) CONTRACTORS FOR THE GENERAL ROUTINE MAINTENANCE OF BUILDINGS, WATER SUPPLY SYSTEM INCLUDING SEWER PUMP STATIONS, MECHANICAL, ELECTRICAL, DREDGING, BOREHOLE STRUCTURES, DAM-RESEALING AND SPECIALIZED WORK AS AND WHEN REQUIRED",23/08/2024,10/10/2024,Mangaung Metropolitan Municipality,Request for Bid,Free State,Bloemfontein,,,,,,,,11:30am,,,,https://www.mangaung.co.za/2024/08/23/list-of-available-bids-188/,,Mangaung
Municipal,MMM/BID 760: 2024/2025,REFURBISHMENT AND EXPANSION OF THE TELEMETRY AND SCADA SYSTEM INCLUDING WATER NETWORK CONTROL EQUIPMENT FOR WATER INFRASTRUCTURE WITHIN THE MANGAUNG METROPOLITAN MUNICIPAL AREA.,23/08/2024,14/10/2024,Mangaung Metropolitan Municipality,Request for Bid,Free State,Bloemfontein,,,,,,,,11:30am,,,,https://www.mangaung.co.za/2024/08/23/list-of-available-bids-188/,,Mangaung
Municipal,MMM/BID 687 (AA): 2023/2024,APPOINTMENT OF A PANEL OF REGISTERED DEBT COLLECTORS FOR THE MANGAUNG METRO MUNICIPALITY. (BIDDERS WHO PREVIOUSLY BOUGHT THE ABOVE-MENTIONED BID SHALL BE ISSUED OUT WITH THE SAID DOCUMENT FREE OF CHARGE),15/05/2024,03/06/2024,Mangaung Metropolitan Municipality,Request for Bid,Free State,Bloemfontein,,,,,,,,11:30am,,,,https://www.mangaung.co.za/2024/05/15/list-of-available-bids-186/,,Mangaung
Municipal,MMM/BID 741: 2023/2024,SUPPLY AND DELIVERY OF PAINT AND OTHER RELATED ITEMS FOR MANGAUNG METROPOLITAN MUNICIPALITY,15/05/2024,19/06/2024,Mangaung Metropolitan Municipality,Request for Bid,Free State,Bloemfontein,,,,,,,,11:30am,,,,https://www.mangaung.co.za/2024/05/15/list-of-available-bids-186/,,Mangaung
Municipal,MMM/BID 742: 2023/2024,"SUPPLY AND DELIVERY OF BODY ARMOUR (BULLET PROOF VESTS MALE AND FEMALE) FOR MANGAUNG METROPOLITAN MUNICIPALITY PUBLIC SAFETY AND SECURITY DIRECTORATE: SUB-DIRECTORATES (TRAFFIC, SECURITY SERVICES, LAW ENFORCEMENT, METRO POLICE AND VIP PROTECTORS)",15/05/2024,20/06/2024,Mangaung Metropolitan Municipality,Request for Bid,Free State,Bloemfontein,,,,,,,,11:30am,,,,https://www.mangaung.co.za/2024/05/15/list-of-available-bids-186/,,Mangaung
Municipal,MMM/BID 743: 2023/2024,"PANEL OF SERVICE PROVIDERS FOR SUPPLY, DELIVERY OF FUEL AND LUBRICANTS AS AND WHEN REQUIRED",15/05/2024,21/06/2024,Mangaung Metropolitan Municipality,Request for Bid,Free State,Bloemfontein,,,,,,,,11:30am,,,,https://www.mangaung.co.za/2024/05/15/list-of-available-bids-186/,,Mangaung
Municipal,MMM/BID 721: 2023/2024,CITY ENTRANCE BEATIFICATION MASELSPOORT DRIVE IN MANGAUNG METRO MUNICIPALITY –(CANCELLED BID),27/03/2024,22/03/2024,Mangaung Metropolitan Municipality,Request for Bid,Free State,Bloemfontein,,,,,,,,11:30am,,,,https://www.mangaung.co.za/2024/03/27/list-of-available-bids-184/,,Mangaung
Municipal,MMM/BID 726: 2023/2024,"SUPPLY, INSTALL AND MAINTENANCE OF TRACKER DEVICE ON MANGAUNG METRO MUNICIPAL VEHICLES AND EQUIPMENT.",27/03/2024,30/04/2024,Mangaung Metropolitan Municipality,Request for Bid,Free State,Bloemfontein,,,,,,,,11:30am,,,,https://www.mangaung.co.za/2024/03/27/list-of-available-bids-184/,,Mangaung
Municipal,MMM/BID 727: 2023/2024,PANEL OF SERVICE PROVIDERS FOR HIRING OF VEHICLES /EQUIPMENT FOR MMM AS AND WHEN REQUIRED,27/03/2024,02/05/2024,Mangaung Metropolitan Municipality,Request for Bid,Free State,Bloemfontein,,,,,,,,11:30am,,,,https://www.mangaung.co.za/2024/03/27/list-of-available-bids-184/,,Mangaung
Municipal,MMM/BID 728: 2023/2024,THE APPOINTMENT OF SERVICE PROVIDERS FOR THIRD-PARTY PAYMENT METHODS FOR MUNICIPAL ACCOUNTS Click here to download the PDF for Cancelled-Withdrawn BIDS – 728 – Published on: 15 October 2024,27/03/2024,02/05/2024,Mangaung Metropolitan Municipality,Request for Bid,Free State,Bloemfontein,,,,,,,,11:30am,,,,https://www.mangaung.co.za/2024/03/27/list-of-available-bids-184/,,Mangaung
Municipal,MMM/BID 720: 2023/2024 – ERRATUM,PRUNING OF TREES IN THE MANGAUNG METRO MUNICIPALITY,07/03/2024,21/03/2024,Mangaung Metropolitan Municipality,Request for Bid,Free State,Bloemfontein,,,,,,,,11:30am,,,,https://www.mangaung.co.za/2024/03/07/list-of-available-bids-183/,,Mangaung
Municipal,MMM/BID 722: 2023/2024,"EMERGENCY UNBLOCKING, MAINTENANCE AND REPLACEMENT OF MANHOLES AND SEWER PIPES AROUND MANGAUNG METROPOLITAN MUNICIPALITY, AS AND WHEN REQUIRED.",07/03/2024,11/04/2024,Mangaung Metropolitan Municipality,Request for Bid,Free State,Bloemfontein,,,,,,,,,,,,https://www.mangaung.co.za/2024/03/07/list-of-available-bids-183/,,Mangaung
Municipal,MMM/BID 723: 2023/2024,"RENDERING OF NECESSARY ASSESSMENTS OF BUILDINGS, LABOUR, MATERIAL, SPARES AND REPAIR WORK IN RESPECT OF ELECTRICAL SERVICES AND MAINTENANCE WORK, INCLUDING INSTALLATION ON MUNICIPAL BUILDING",07/03/2024,15/04/2024,Mangaung Metropolitan Municipality,Request for Bid,Free State,Bloemfontein,,,,,,,,11:30am,,,,https://www.mangaung.co.za/2024/03/07/list-of-available-bids-183/,,Mangaung
Municipal,MMM/BID 724: 2023/2024,OUTDOOR ADVERTISEMENT RIGHTS – COOLING TOWERS,07/03/2024,15/04/2024,Mangaung Metropolitan Municipality,Request for Bid,Free State,Bloemfontein,,,,,,,,11:30am,,,,https://www.mangaung.co.za/2024/03/07/list-of-available-bids-183/,,Mangaung
Municipal,MMM/BID 725: 2023/2024,APPOINTMENT OF SERVICE PROVIDERS FOR THE SUPPLY AND DELIVERY OF VARIOUS CATEGORIES OF VEHICLES UNDER FULL MAINTENANCE LEASE,07/03/2024,09/04/2024,Mangaung Metropolitan Municipality,Request for Bid,Free State,Bloemfontein,,,,,,,,11:30am,,,,https://www.mangaung.co.za/2024/03/07/list-of-available-bids-183/,,Mangaung
Municipal,MMM/BID 716: 2023/2024,GARDEN DEVELOPMENT- BRAM FISCHER BUILDING AND CITY HALL,12/02/2024,15/03/2024,Mangaung Metropolitan Municipality,Request for Bid,Free State,Bloemfontein,,,,,,,,,,,,https://www.mangaung.co.za/2024/02/12/list-of-available-bids-182/,,Mangaung
Municipal,MMM/BID 717: 2023/2024,"APPOINTMENT OF SERVICE PROVIDERS TO SUPPLY, DELIVER, REPAIR AND INSTALLATION OF ALL RELATED ALLUMINIUM AND GLASS WORKS ON A NORMAL AND EMERGENCY BASIS (AS AND WHEN) FOR MANGAUNG METRO MUNICIPALITY",12/02/2024,19/03/2024,Mangaung Metropolitan Municipality,Request for Bid,Free State,Bloemfontein,,,,,,,,11:30am,,,,https://www.mangaung.co.za/2024/02/12/list-of-available-bids-182/,,Mangaung
Municipal,MMM/BID 718: 2023/2024,APPOINTMENT OF A PANEL OF CONSULTING FIRMS TO ASSIST THE FINANCE DEPARTMENT IN PERFORMING FINANCE RELATED ASSIGNMENTS,12/02/2024,20/03/2024,Mangaung Metropolitan Municipality,Request for Bid,Free State,Bloemfontein,,,,,,,,11:30am,,,,https://www.mangaung.co.za/2024/02/12/list-of-available-bids-182/,,Mangaung
Municipal,MMM/BID 719: 2023/2024,PROVISION OF BANKING SERVICES,12/02/2024,10/04/2024,Mangaung Metropolitan Municipality,Request for Bid,Free State,Bloemfontein,,,,,,,,11:30am,,,,https://www.mangaung.co.za/2024/02/12/list-of-available-bids-182/,,Mangaung
Municipal,MMM/BID 720: 2023/2024,PRUNING OF TREES IN THE MANGAUNG METRO MUNICIPALITY,12/02/2024,21/03/2024,Mangaung Metropolitan Municipality,Request for Bid,Free State,Bloemfontein,,,,,,,,11:30am,,,,https://www.mangaung.co.za/2024/02/12/list-of-available-bids-182/,,Mangaung
Municipal,MMM/BID 708: 2023/2024 – Erratum,"APPOINTMENT OF A PANEL OF THREE (03) SERVICE PROVIDERS FOR THE SUPPLY AND DELIVERY OF WATER TREATMENT CHEMICALS, DOSING EQUIPMENT, TESTING EQUIPMENT AND LAB WARE. BIDDERS WHO PREVIOUSLY ATTENDED THE BRIEFING SESSION ON THE 02 OF FEBRUARY 2024 ARE NOT COMPELLED TO ATTEND",02/02/2024,09/02/2024,Mangaung Metropolitan Municipality,Request for Bid,Free State,Bloemfontein,,,,,,,,11:30am,,,,https://www.mangaung.co.za/2024/02/02/list-of-available-bids-181/,,Mangaung
Municipal,MMM/BID 691(A): 2023/2024,APPOINTMENT OF TWO (02) CONTRACTORS FOR REPLACEMENT OF WATER METERS AND METERING OF UNMETERED SITES IN ALL AREAS OF MANGAUNG METRO MUNICIPALITY AS AND WHEN REQUIRED. (BIDDERS WHO PREVIOUSLY BOUGHT THE ABOVE-MENTIONED BID WILL BE ISSUED OUT WITH THE DOCUMENT FREE OF CHARGE),02/02/2024,05/03/2024,Mangaung Metropolitan Municipality,Request for Bid,Free State,Bloemfontein,,,,,,,,11:30am,,,,https://www.mangaung.co.za/2024/02/02/list-of-available-bids-181/,,Mangaung
Municipal,MMM/BID 687(A): 2023/2024,APPOINTMENT OF A PANEL OF REGISTERED DEBT COLLECTORS FOR THE MANGAUNG METRO MUNICIPALITY. (BIDDERS WHO PREVIOUSLY BOUGHT THE ABOVE-MENTIONED BID WILL BE ISSUED OUT WITH THE DOCUMENT FREE OF CHARGE),02/02/2024,16/02/2024,Mangaung Metropolitan Municipality,Request for Bid,Free State,Bloemfontein,,,,,,,,11:30am,,,,https://www.mangaung.co.za/2024/02/02/list-of-available-bids-181/,,Mangaung
Municipal,MMM/BID 711: 2023/2024,"WATERPROOFING AND MAINTENANCE OF DIFFERENT TYPES OF ROOFS, REPAIRS TO RELATED ROOF COVERING AND OTHER ACCESSORIES FOR THE MANGAUNG METRO MUNICIPALITY.",02/02/2024,07/03/2024,Mangaung Metropolitan Municipality,Request for Bid,Free State,Bloemfontein,,,,,,,,11:30am,,,,https://www.mangaung.co.za/2024/02/02/list-of-available-bids-181/,,Mangaung
Municipal,MMM/BID 712: 2023/2024,"THE INSTALLATION, SUPPLY, MAINTENANCE, INSPECTION AND SERVICING OF FIREFIGHTING EQUIPMENT’S IN THE BUILDINGS FOR MANGAUNG METRO MUNICIPALITY",02/02/2024,07/03/2024,Mangaung Metropolitan Municipality,Request for Bid,Free State,Bloemfontein,,,,,,,,11:30am,,,,https://www.mangaung.co.za/2024/02/02/list-of-available-bids-181/,,Mangaung
Municipal,MMM/BID 713: 2023/2024,APPOINTMENT OF A PANEL OF SERVICE PROVIDER FOR DISCONNECTION AND RECONNECTION OF WATER METERS FOR MANGAUNG METRO MUNICIPALITY AS AND WHEN REQUIRED,02/02/2024,11/03/2024,Mangaung Metropolitan Municipality,Request for Bid,Free State,Bloemfontein,,,,,,,,11:30am,,,,https://www.mangaung.co.za/2024/02/02/list-of-available-bids-181/,,Mangaung
Municipal,MMM/BID 714: 2023/2024,SUPPLY AND DELIVERY OF FACE VALUE BOOKS AND OTHER RELATED ITEMS FOR MANGAUNG METRO MUNICIPALITY.,02/02/2024,13/03/2024,Mangaung Metropolitan Municipality,Request for Bid,Free State,Bloemfontein,,,,,,,,11:30am,,,,https://www.mangaung.co.za/2024/02/02/list-of-available-bids-181/,,Mangaung
Municipal,MMM/BID 715: 2023/2024,"SUPPLY, DELIVERY AND INSTALLATION OF MOBILE SHELVING UNITS FOR OFFICES OF THE MANGAUNG METRO MUNICIPALITY.",02/02/2024,14/03/2024,Mangaung Metropolitan Municipality,Request for Bid,Free State,Bloemfontein,,,,,,,,11:30am,,,,https://www.mangaung.co.za/2024/02/02/list-of-available-bids-181/,,Mangaung
Municipal,MMM/BID 703: 2023/2024,COMMUNICATIONS AND MARKETING SERVICES FOR MANGAUNG METRO MUNICIPALITY,26/01/2024,28/02/2024,Mangaung Metropolitan Municipality,Request for Bid,Free State,Bloemfontein,,,,,,,,11:30am,,,,https://www.mangaung.co.za/2024/01/26/list-of-available-bids-180/,,Mangaung
Municipal,MMM/BID 704: 2023/2024,"SUPPLY, DELIVERY AND INSTALLATION OF DIFFERENT TYPES OF REFUSE RECEPTACLES FOR THE CENTRAL BUSINESS DISTRICT OF THE MANGAUNG METROPOLITAN MUNICIPALITYAS AND WHEN REQUIRED.",26/01/2024,28/02/2024,Mangaung Metropolitan Municipality,Request for Bid,Free State,Bloemfontein,,,,,,,,11:30am,,,,https://www.mangaung.co.za/2024/01/26/list-of-available-bids-180/,,Mangaung
Municipal,MMM/BID 705: 2023/2024,"PURCHASING, SUPPLY, DELIVERY, INSTALLATION AND COMMISSIONING OF ELECTRONIC TRAFFIC LAW ENFORCEMENT SYSTEM AND EQUIPMENT FOR TRAFFIC VIOLATIONS.",26/01/2024,29/02/2024,Mangaung Metropolitan Municipality,Request for Bid,Free State,Bloemfontein,,,,,,,,11:30am,,,,https://www.mangaung.co.za/2024/01/26/list-of-available-bids-180/,,Mangaung
Municipal,MMM/BID 706: 2023/2024,CITY ENTRANCE BEAUTIFICATION NELSON MANDELA DRIVE IN MANGAUNG METROPOLITAN MUNICIPALITY,26/01/2024,27/02/2024,Mangaung Metropolitan Municipality,Request for Bid,Free State,Bloemfontein,,,,,,,,11:30am,,,,https://www.mangaung.co.za/2024/01/26/list-of-available-bids-180/,,Mangaung
Municipal,MMM/BID 707: 2023/2024,UPGRADING OF A PARK NEXT TO NEW BOTSHABELO MALL.,26/01/2024,27/02/2024,Mangaung Metropolitan Municipality,Request for Bid,Free State,Bloemfontein,,,,,,,,11:30am,,,,https://www.mangaung.co.za/2024/01/26/list-of-available-bids-180/,,Mangaung
Municipal,MMM/BID 708: 2023/2024,"APPOINTMENT OF A PANEL OF THREE (03) SERVICE PROVIDERS FOR THE SUPPLY AND DELIVERY OF WATER TREATMENT CHEMICALS, DOSING EQUIPMENT, TESTING EQUIPMENT AND LAB WARE.",26/01/2024,09/02/2024,Mangaung Metropolitan Municipality,Request for Bid,Free State,Bloemfontein,,,,,,,,11:30am,,,,https://www.mangaung.co.za/2024/01/26/list-of-available-bids-180/,,Mangaung
Municipal,MMM/BID 709: 2023/2024,APPOINTMENT OF PANEL OF TRAINING SERVICE PROVIDERS FOR DISCRETIONARY GRANTS PROGRAMMES.,26/01/2024,29/02/2024,Mangaung Metropolitan Municipality,Request for Bid,Free State,Bloemfontein,,,,,,,,11:30am,,,,https://www.mangaung.co.za/2024/01/26/list-of-available-bids-180/,,Mangaung
Municipal,MMM/BID 710: 2023/2024,"SUPPLY AND DELIVERY OF SPECIALISED PAPER, ENVELOPING AND SORTING OF MONTHLY BILLS, MONTHLY DISCONNECTION WARNING NOTICES AND ANY OTHER MATERIAL RELATED TO REVENUE MANAGEMENT AS THE NEED ARISES; AND PRINTING OF MONTHLY BILLS",26/01/2024,01/01/2024,Mangaung Metropolitan Municipality,Request for Bid,Free State,Bloemfontein,,,,,,,,11:30am,,,,https://www.mangaung.co.za/2024/01/26/list-of-available-bids-180/,,Mangaung
Municipal,MMM/BID 700: 2023/2024,SUPPLY AND DELIVERY OF LUCERNE AND TEFF SQUARE BALES FOR ANIMAL FEEDING IN THE BLOEMFONTEIN ZOO.,28/09/2023,31/10/2023,Mangaung Metropolitan Municipality,Request for Bid,Free State,Bloemfontein,,,,,,,,11:30am,,,,https://www.mangaung.co.za/2023/09/28/list-of-available-bids-179/,,Mangaung
Municipal,MMM/BID 701: 2023/2024,OUTDOOR ADVERTISING RIGHTS – COOLING TOWERS IN MANGAUNG METROPOLITAN MUNICIPALITY,28/09/2023,03/11/2023,Mangaung Metropolitan Municipality,Request for Bid,Free State,Bloemfontein,,,,,,,,11:30am,,,,https://www.mangaung.co.za/2023/09/28/list-of-available-bids-179/,,Mangaung
Municipal,MMM/BID 702: 2023/2024,RECREATION OF PARKS – VISTA PARK,28/09/2023,02/11/2023,Mangaung Metropolitan Municipality,Request for Bid,Free State,Bloemfontein,,,,,,,,11:30am,,,,https://www.mangaung.co.za/2023/09/28/list-of-available-bids-179/,,Mangaung
Municipal,MMM/BID 699: 2023/2024,PANEL OF SERVICE PROVIDERS FOR RENDERING OF TRADE WASTE COLLECTION SERVICE FROM BUSINESSES WITHIN MANGAUNG METRO MUNICIPALITY,01/09/2023,03/10/2023,Mangaung Metropolitan Municipality,Request for Bid,Free State,Bloemfontein,,,,,,,,11:30am,,,,https://www.mangaung.co.za/2023/09/01/list-of-available-bids-178/,,Mangaung
Municipal,MMM/BID 664(A): 2023/2024,UNDERWRITING AND MANAGEMENT OF THE SHORT-TERM INSURANCE PORTFOLIO OF THE MANGAUNG METROPOLITAN MUNICIPALITY. (BIDDERS WHO PREVIOUSLY BOUGHT THE ABOVE MENTIONED BID DOCUMENT WILL BE ISSUED OUT WITH THE SAID FREE OF CHARGE).,16/08/2023,29/08/2023,Mangaung Metropolitan Municipality,Request for Bid,Free State,Bloemfontein,,,,,,,,11:30am,,,,https://www.mangaung.co.za/2023/08/16/list-of-available-bids-177/,,Mangaung
Municipal,MMM/BID 697: 2023/2024,"UPGRADING AND REHABILITATION OF STREETS/ROADS & STORMWATER, AND INFRASTRUCTURE/ TRANSPORT RELATED FACILITIES: PANEL OF CONTRACTORS.",11/08/2023,14/09/2023,Mangaung Metropolitan Municipality,Request for Bid,Free State,Bloemfontein,,,,,,,,11:30am,,,,https://www.mangaung.co.za/2023/08/11/list-of-available-bids-176/,,Mangaung
